{
  "schema_version": "1.0.0",
  "context": {
    "workspace_id": "ws-demo",
    "session_id": "session-demo",
    "run_id": "run-demo",
    "document_id": "fs-demo",
    "base_document_version": "dv-7",
    "context_snapshot_id": "ctx-7",
    "template_id": "traditional-abap-five",
    "template_version": "1.0.0"
  },
  "id": "ev-message-1",
  "source_kind": "message",
  "source_id": "msg-1",
  "source_revision": "1",
  "content_hash": "fixture-hash-msg1",
  "locator": "message:msg-1#chars=0-20",
  "conclusion": "用户要求供应商未清项批量处理",
  "target": null,
  "scope": "用户表达的需求意图",
  "collected_at": "2026-10-03T08:00:00Z",
  "expires_at": null,
  "limitations": [
    "不能证明 SAP 元数据或客户已批准规则"
  ],
  "tool_receipt_id": null,
  "access_scope_id": "project-demo"
}
